{
  "schema": "pulsetensor/ptauth-envelope/v1",
  "protocolVersion": "1",
  "chainId": 943,
  "nodeRegistry": "0x7777777777777777777777777777777777777777",
  "netuid": 1,
  "mechid": 0,
  "senderOperator": "0x2222222222222222222222222222222222222222",
  "receiverOperator": "0x4444444444444444444444444444444444444444",
  "messageType": "TASK_EXECUTE",
  "methodHash": "0x2626262626262626262626262626262626262626262626262626262626262626",
  "requestTargetHash": "0x2727272727272727272727272727272727272727272727272727272727272727",
  "rawBodyHash": "0x2828282828282828282828282828282828282828282828282828282828282828",
  "taskId": "0xaaaaaaaaaaaaaaaaaaaaaaaaaaaaaaaaaaaaaaaaaaaaaaaaaaaaaaaaaaaaaaaa",
  "attemptId": "0x0404040404040404040404040404040404040404040404040404040404040404",
  "nonce": "11",
  "referenceBlockNumber": "1000",
  "referenceBlockHash": "0x2929292929292929292929292929292929292929292929292929292929292929",
  "expiresAtBlock": "1005",
  "signature": "0x5555555555555555555555555555555555555555555555555555555555555555555555555555555555555555555555555555555555555555555555555555555555"
}
